{"schema_version":"1.0","context_type":"kns_ai_context","depth":"quick","network":{"node_count":2,"link_count":1,"connected":true,"connected_components":1},"routing":{"reachable_routes":2,"unreachable_routes":0,"average_hop_count":1,"maximum_hop_count":1,"average_routing_distance":1,"maximum_routing_distance":1},"performance":{"average_path_delay_ms":1,"maximum_path_delay_ms":1,"average_bottleneck_bandwidth_mbps":100,"minimum_bottleneck_bandwidth_mbps":100},"structural_risks":{"isolated_nodes":[],"articulation_points":[],"bridge_count":1},"critical_nodes":[],"critical_links":[],"findings":[]}
